{
  "$schema": "https://json-schema.org/draft/2020-12/schema",
  "$id": "geo/schema/normalized-evidence.schema.json",
  "type": "object",
  "required": ["schema_version", "validator_version", "extraction_version", "policy", "observations"],
  "properties": {
    "schema_version": { "const": "geo.normalized_evidence.v1" },
    "validator_version": { "type": "string" },
    "extraction_version": { "type": "string" },
    "policy": { "type": "object" },
    "observations": { "type": "array" }
  }
}
